{
  "$schema": "http://json-schema.org/draft-07/schema#",
  "type": "object",
  "properties": {
    "preparationPackage": {
      "type": "string"
    },
    "preparedFeaturesPath": {
      "type": "string"
    },
    "classBalancingReport": {
      "type": "string"
    },
    "featureSpaceAnomalousReport": {
      "type": "string"
    },
    "featureSpaceRegularReport": {
      "type": "string"
    },
    "trainingSetPath": {
      "type": "string"
    },
    "validationSetPath": {
      "type": "string"
    },
    "testSetPath": {
      "type": "string"
    },
    "minimumNumberOfFeatures": {
      "type": "integer",
      "minimum": 3
    },
    "trainingSetSize": {
      "type": "integer",
      "minimum": 1,
      "maximum": 100
    },
    "validationSetSize": {
      "type": "integer",
      "minimum": 1,
      "maximum": 100
    },
    "testSetSize": {
      "type": "integer",
      "minimum": 1,
      "maximum": 100
    },
    "classBalanceThreshold": {
      "type": "integer",
      "minimum": 0,
      "maximum": 100
    }
  },
  "required": [
    "preparationPackage",
    "preparedFeaturesPath",
    "classBalancingReport",
    "featureSpaceAnomalousReport",
    "featureSpaceRegularReport",
    "trainingSetPath",
    "validationSetPath",
    "testSetPath",
    "minimumNumberOfFeatures",
    "trainingSetSize",
    "validationSetSize",
    "testSetSize",
    "classBalanceThreshold"
  ],
  "additionalProperties": false
}